{
  "$schema": "./validation-surfaces.schema.json",
  "schemaVersion": 2,
  "pathSemantics": {
    "separator": "posix",
    "matching": "exact-or-anchored-regex",
    "caseSensitive": true,
    "precedence": "none"
  },
  "lanes": [
    "affected",
    "staged",
    "all-files",
    "message/manual",
    "ci",
    "remote/live",
    "inventory"
  ],
  "protectedLevels": ["none", "review", "protected"],
  "evidenceLanes": ["repo-static", "ci", "remote/live"],
  "validators": [
    {
      "id": "agent-checkpoint",
      "argv": ["python3", "scripts/validate-agent-checkpoint.py", "--root", ".", "--self-test"],
      "lanes": ["affected", "staged", "all-files", "ci"],
      "optional": false,
      "fallback": {"status": "FAIL", "reason": "Agent checkpoint validation is required."},
      "evidenceLane": "repo-static"
    },
    {
      "id": "agent-harness-contract",
      "argv": ["python3", "scripts/validate-agent-harness-contract.py", "--root", "."],
      "lanes": ["affected", "staged", "all-files", "ci"],
      "optional": false,
      "fallback": {"status": "FAIL", "reason": "Provider-neutral harness contract validation is required."},
      "evidenceLane": "repo-static"
    },
    {
      "id": "agent-loop-lifecycle",
      "argv": ["python3", "scripts/validate-agent-loop-lifecycle.py", "--root", "."],
      "lanes": ["affected", "staged", "all-files", "ci"],
      "optional": false,
      "fallback": {"status": "FAIL", "reason": "Agent loop lifecycle validation is required."},
      "evidenceLane": "repo-static"
    },
    {
      "id": "agent-provider-evidence",
      "argv": ["python3", "scripts/validate-agent-provider-evidence.py", "--root", "."],
      "lanes": ["affected", "staged", "all-files", "ci"],
      "optional": false,
      "fallback": {"status": "FAIL", "reason": "Provider-native evidence boundary validation is required."},
      "evidenceLane": "repo-static"
    },
    {
      "id": "agent-roster-admission",
      "argv": ["python3", "scripts/validate-agent-roster-admission.py", "--root", "."],
      "lanes": ["affected", "staged", "all-files", "ci"],
      "optional": false,
      "fallback": {"status": "FAIL", "reason": "Spec 044 roster admission validation is required."},
      "evidenceLane": "repo-static"
    },
    {
      "id": "agent-evaluations",
      "argv": ["python3", "scripts/validate-agent-evaluations.py", "--root", "."],
      "lanes": ["affected", "staged", "all-files", "ci"],
      "optional": false,
      "fallback": {"status": "FAIL", "reason": "Spec 044 role evaluation validation is required."},
      "evidenceLane": "repo-static"
    },
    {
      "id": "agent-model-fitness",
      "argv": ["python3", "scripts/validate-agent-model-fitness.py", "--root", "."],
      "lanes": ["affected", "staged", "all-files", "ci"],
      "optional": false,
      "fallback": {"status": "FAIL", "reason": "Spec 044 model-fitness validation is required."},
      "evidenceLane": "repo-static"
    },
    {
      "id": "agent-roster-currentness",
      "argv": ["python3", "scripts/validate-agent-roster-currentness.py", "."],
      "lanes": ["affected", "staged", "all-files", "ci"],
      "optional": false,
      "fallback": {"status": "FAIL", "reason": "Canonical provider roster validation is required."},
      "evidenceLane": "repo-static"
    },
    {
      "id": "document-contract-registry",
      "argv": ["python3", "scripts/validate-document-contract-registry.py", "--root", ".", "--mode", "strict"],
      "pathInput": "include-existing-markdown",
      "lanes": ["affected", "staged", "all-files", "ci"],
      "optional": false,
      "fallback": {"status": "FAIL", "reason": "Document path classification is required."},
      "evidenceLane": "repo-static"
    },
    {
      "id": "gitops-change-set",
      "argv": ["python3", "scripts/validate-gitops-change-set.py", "--root", ".", "--base-ref", "HEAD"],
      "lanes": ["affected", "staged"],
      "optional": false,
      "fallback": {"status": "FAIL", "reason": "Identity-only GitOps change-set review is required."},
      "evidenceLane": "repo-static"
    },
    {
      "id": "gitops-structure",
      "argv": ["bash", "scripts/validate-gitops-structure.sh"],
      "lanes": ["affected", "staged", "all-files", "ci"],
      "optional": false,
      "fallback": {"status": "FAIL", "reason": "Argo CD hierarchy validation is required."},
      "evidenceLane": "repo-static"
    },
    {
      "id": "infrastructure-contracts",
      "argv": ["bash", "infrastructure/tests/verify-contracts-static.sh"],
      "lanes": ["affected", "staged", "all-files", "ci"],
      "optional": false,
      "fallback": {"status": "FAIL", "reason": "Static infrastructure contracts are required."},
      "evidenceLane": "repo-static"
    },
    {
      "id": "k8s-manifests",
      "argv": ["bash", "scripts/validate-k8s-manifests.sh", "."],
      "lanes": ["affected", "staged", "all-files", "ci"],
      "optional": false,
      "fallback": {"status": "FAIL", "reason": "Manifest syntax fallback remains mandatory."},
      "evidenceLane": "repo-static"
    },
    {
      "id": "links-and-owners",
      "argv": ["python3", "scripts/validate-links-and-owners.py", "--root", ".", "--mode", "strict"],
      "pathInput": "include-existing-markdown",
      "lanes": ["affected", "staged", "all-files", "ci"],
      "optional": false,
      "fallback": {"status": "FAIL", "reason": "Cross-document ownership validation is required."},
      "evidenceLane": "repo-static"
    },
    {
      "id": "markdown-profiles",
      "argv": ["python3", "scripts/validate-markdown-profiles.py", "--root", ".", "--mode", "strict"],
      "pathInput": "include-existing-markdown",
      "lanes": ["affected", "staged", "all-files", "ci"],
      "optional": false,
      "fallback": {"status": "FAIL", "reason": "Authored Markdown semantics are required."},
      "evidenceLane": "repo-static"
    },
    {
      "id": "policy-gates",
      "argv": ["bash", "scripts/validate-policy-gates.sh", "."],
      "lanes": ["affected", "staged", "all-files", "ci"],
      "optional": false,
      "fallback": {"status": "FAIL", "reason": "Built-in policy fallback remains mandatory."},
      "evidenceLane": "repo-static"
    },
    {
      "id": "repository-quality",
      "argv": ["bash", "scripts/validate-repo-quality-gates.sh", "."],
      "lanes": ["affected", "staged", "all-files", "ci"],
      "optional": false,
      "fallback": {"status": "FAIL", "reason": "Repository quality validation is required."},
      "evidenceLane": "repo-static"
    },
    {
      "id": "secret-handling",
      "argv": ["bash", "scripts/check-secret-handling.sh", "."],
      "lanes": ["affected", "staged", "all-files", "ci"],
      "optional": false,
      "fallback": {"status": "FAIL", "reason": "Redacted plaintext-secret scanning is required."},
      "evidenceLane": "repo-static"
    },
    {
      "id": "vault-eso-contracts",
      "argv": ["python3", "scripts/validate-vault-eso-contracts.py", "--root", "."],
      "lanes": ["affected", "staged", "all-files", "ci"],
      "optional": false,
      "fallback": {"status": "FAIL", "reason": "Vault and ESO safety contracts are required."},
      "evidenceLane": "repo-static"
    }
  ],
  "ciJobs": [
    {"id": "manifest-static", "output": "manifests", "evidenceLane": "ci"},
    {"id": "pre-commit", "output": "precommit", "evidenceLane": "ci"},
    {"id": "repo-quality-static", "output": "repo_quality", "evidenceLane": "ci"}
  ],
  "surfaces": [
    {
      "id": "root-config",
      "routes": [
        {"kind": "exact", "value": ".cz.toml"},
        {"kind": "exact", "value": ".editorconfig"},
        {"kind": "exact", "value": ".env.example"},
        {"kind": "exact", "value": ".eslintignore"},
        {"kind": "exact", "value": ".gitattributes"},
        {"kind": "exact", "value": ".gitignore"},
        {"kind": "exact", "value": ".gitleaks.toml"},
        {"kind": "exact", "value": ".gitmessage"},
        {"kind": "exact", "value": ".graphifyignore"},
        {"kind": "exact", "value": ".hadolint.yaml"},
        {"kind": "exact", "value": ".kube-linter.yaml"},
        {"kind": "exact", "value": ".markdownlint-cli2.yaml"},
        {"kind": "exact", "value": ".pre-commit-config.yaml"},
        {"kind": "exact", "value": ".prettierignore"},
        {"kind": "exact", "value": ".prettierrc.json"},
        {"kind": "exact", "value": ".secrets.baseline"},
        {"kind": "exact", "value": "README.md"},
        {"kind": "exact", "value": "RTK.md"},
        {"kind": "exact", "value": "cliff.toml"}
      ],
      "validators": ["repository-quality"],
      "ciJobs": ["pre-commit", "repo-quality-static"],
      "protectedLevel": "review",
      "fallback": {"status": "FAIL", "reason": "New root files require an explicit route."},
      "evidenceLane": "repo-static"
    },
    {
      "id": "provider-gateways",
      "routes": [
        {"kind": "exact", "value": "AGENTS.md"},
        {"kind": "exact", "value": "CLAUDE.md"},
        {"kind": "exact", "value": "GEMINI.md"}
      ],
      "validators": ["agent-checkpoint", "agent-harness-contract", "agent-loop-lifecycle", "agent-provider-evidence", "agent-roster-admission", "agent-evaluations", "agent-model-fitness", "agent-roster-currentness", "document-contract-registry", "links-and-owners", "markdown-profiles", "repository-quality"],
      "ciJobs": ["pre-commit", "repo-quality-static"],
      "protectedLevel": "protected",
      "fallback": {"status": "FAIL", "reason": "Provider gateways must remain thin and aligned."},
      "evidenceLane": "repo-static"
    },
    {
      "id": "workspace-boundary",
      "routes": [{"kind": "exact", "value": "_workspace/README.md"}],
      "validators": ["document-contract-registry", "links-and-owners", "markdown-profiles", "repository-quality"],
      "ciJobs": ["pre-commit", "repo-quality-static"],
      "protectedLevel": "review",